id,published_at,title,symbol,name,snippet,highlight,url,sentiment
5,2023-06-15T14:00:17.000000Z,Logica Capital May 2023 Commentary,NVDA,NVIDIA Corporation,"Learn the Insider Secrets of what the Top Hedge Funds are doing TODAY to maximize their upside and gains.

Gates Cap Management Reduces Risk After Rare Down Yea...","State of play: The big five that are responsible for the vast majority of the stock market’s 2023 gains are Apple (up 36% this year), Microsoft (37%), Alphabet (39%), Amazon (44%), and current stock market darling <em>Nvidia</em>, which has surged 159% on AI-related excitement.",https://www.valuewalk.com/logica-capital-may-2023-commentary/,0.93
1,2023-06-15T13:58:24.000000Z,Nvidia And AMD Paint The Same Growth Picture (NASDAQ:AMD),NVDA,NVIDIA Corporation,"Just_Super

On Tuesday, Advanced Micro Devices, Inc. (NASDAQ:AMD) hosted its ""Data Center and AI Technology Premier."" Some investors (including me) may have bee...",Su's claim that the market for AI chips will cross $150 billion by 2027 aligns with <em>Nvidia</em> <em>Corporation</em> (<em>NASDAQ:NVDA</em>) CEO Jensen Huang's statements during Nvidia's last earnings call about trillions of dollars of data center infrastructure being built or replaced in coming years.,https://seekingalpha.com/article/4611711-nvidia-and-amd-paint-same-growth-picture,0.0
3,2023-06-15T13:55:00.000000Z,Как добавить жару китайской экономике,NVDA,NVIDIA Corporation,"TSLA +0,19% Добавить/Убрать из портфеля NVDA -0,68% Добавить/Убрать из портфеля

Не просто же так ?...","TSLA +0,19% Добавить/Убрать из портфеля NVDA -0,68% Добавить/Убрать из портфеля

Не просто же так в Китай ездили главы Tesla (NASDAQ: ) и <em>Nvidia</em> (NASDAQ: ), а теперь и еще Билл Гейтс собирается ;)



Похоже, что власти Китая серьезно озабочены этим вопросом.",https://ru.investing.com/analysis/article-200304463,6.705
5,2023-06-15T13:39:08.000000Z,Nvidia: Immensely Overvalued When Looking At The Actual Numbers,NVDA,NVIDIA Corporation,"Justin Sullivan

After witnessing Nvidia Corporation's (NASDAQ:NVDA) rise into the top ranks of the almighty $1 trillion market capitalization club, I believe t...","Justin Sullivan

After witnessing <em>Nvidia</em> Corporation's (<em>NASDAQ:NVDA</em>) rise into the top ranks of the almighty $1 trillion market capitalization club, I believe the time has come to conduct an in-depth analysis of its present valuation.",https://seekingalpha.com/article/4611707-nvidia-immensely-overvalued-when-looking-at-the-actual-numbers,2.023
1,2023-06-15T13:35:12.000000Z,The broader US stocks indices open lower. Off lower levels from overnight trading,NVDA,NVIDIA Corporation,The broader US stock indices Indices Stock market indices represents an index that measures a particular stock market or a segment of the stock market. These in...,"The price is down -6 point dollars and $0.50 or -2.52%

Microsoft is trading at $0.15 or 0.03% at 337.60

<em>Nvidia</em> is trading down $4.99 or -1.16% $425

Google is down $0.90 at $122.78

Apple is up $0.41 at $184.32

Meta is trading down $1.55 at $271.70

Adobe will report earnings after the close and their shares are currently trading down $3.85 or -0.80%",https://www.forexlive.com/news/the-broader-us-stocks-indices-open-lower-off-lower-levels-from-overnight-trading-20230615/,296
3,2023-06-15T13:30:06.000000Z,Should You Invest in Nvidia (NVDA) Based on Bullish Wall Street Views?,NVDA,NVIDIA Corporation,"This page has not been authorized, sponsored, or otherwise approved or endorsed by the companies represented herein. Each of the company logos represented herei...",Should You Invest in <em>Nvidia</em> (NVDA) Based on Bullish Wall Street Views?,https://www.zacks.com/stock/news/2108832/should-you-invest-in-nvidia-nvda-based-on-bullish-wall-street-views?cid=CS-ZC-FT-fundamental_analysis|average_broker_rating-2108832,0.0
5,2023-06-15T13:19:22.000000Z,The Markets Speak: Understand The Herding Effect,NVDA,NVIDIA Corporation,"Marcio Silva

The influence of herd behavior on financial markets is significant. This concept, termed ""animal spirits"" by the celebrated economist Sir John May...","Crown Castle (CCI) (www.ZommaEngine.com)

<em>Nvidia</em> (NVDA) has been powering this bull market. Will clusters of its chips, as the hardware backbone of the AI revolution, become more valuable than human workers? Are Nvidia's chips the new labor force? The market seems to think so.",https://seekingalpha.com/article/4611702-the-markets-speak-understand-the-herding-effect,5.752
1,2023-06-15T12:24:51.000000Z,Analiză XTB: Boom-ul inteligenței artificiale – o privire asupra celor mai promițătoare opt companii din industrie – Income Magazine,NVDA,NVIDIA Corporation,"Nasdaq a câștigat peste 30% de la începutul anului, în ciuda ciclului de înăsprire al Fed și a costurilor de finanțare record. Cursa este condusă de ce...","Privind randamentele cumulate din 2020, <em>Nvidia</em> (NVDA.US) și Arista Networks (ANET.US) apar drept lideri printre companiile AI selectate. Comparația arată, de asemenea, că firmele de AI cu capitalizare mică par a profita pe un orizont de timp de mai mulți ani.",https://incomemagazine.ro/analiza-xtb-boom-ul-inteligentei-artificiale-o-privire-asupra-celor-mai-promitatoare-opt-companii-din-industrie/,296
3,2023-06-15T12:21:10.000000Z,"NVIDIA, Johnson & Johnson And 2 Other Stocks Insiders Are Selling - Johnson & Johnson (NYSE:JNJ), Robinhood Markets (NASDAQ:HOOD)",NVDA,NVIDIA Corporation,"The S&P 500 closed slightly higher on Wednesday. Investors, meanwhile, focused on some notable insider trades.

When insiders sell shares, it indicates their co...","<em>NVIDIA</em>

The Trade: <em>NVIDIA</em> <em>Corporation</em> NVDA Director Harvey C Jones sold a total of 119,795 shares at an average price of $403.17. The insider received around $48.3 million from selling those shares.

Director Harvey C Jones sold a total of 119,795 shares at an average price of $403.17.",https://www.benzinga.com/news/23/06/32872021/nvidia-johnson-johnson-and-2-other-stocks-insiders-are-selling,6.808
5,2023-06-15T12:17:00.000000Z,First Citizen Bancshares and Icahn have been highlighted as Zacks Bull and Bear of the Day,NVDA,NVIDIA Corporation,"For Immediate Release

Chicago, IL – June 15, 2023 – Zacks Equity Research shares First Citizen’s Bancshares FCNCA as the Bull of the Day and Icahn Enterp...","In addition, Zacks Equity Research provides analysis on <em>NVIDIA</em> NVDA, Apple AAPL and Microsoft MSFT.

Here is a synopsis of all five stocks:

Bull of the Day:

Zacks Rank #1 (Strong Buy) stock First Citizen’s Bancshares is a North Carolina-based anomaly in the beaten-down banking sector.",https://finance.yahoo.com/news/first-citizen-bancshares-icahn-highlighted-121700625.html?.tsrc=rss,0.0
1,2023-06-15T12:09:00.000000Z,"TSMC: Стоит ли инвестировать в производителя чипов для Apple, Intel и NVIDIA?",NVDA,NVIDIA Corporation,"INTC +4,92% Добавить/Убрать из портфеля QCOM -0,83% Добавить/Убрать из портфеля AAPL +0,35% Добавить/У?...","Крупнейшие клиенты TSMC — Apple (NASDAQ: ), AMD (NASDAQ: ), Qualcomm Incorporated (NASDAQ: ), MediaTek (TW: ), <em>NVIDIA</em> (NASDAQ: ), Broadcom (NASDAQ: ), Marvell Technology Group (NASDAQ: ) и Intel (NASDAQ: ).",https://ru.investing.com/analysis/article-200304450,5.106
3,2023-06-15T12:02:15.000000Z,Futures Drop As Markets Reasses Fed's Hawkish Skip; ECB Looms,NVDA,NVIDIA Corporation,"Futures are lower, reversing much of the post-hawkish FOMC euphoria, as markets digest the Fed meeting, the decision to halt rates while projecting two more rat...","<em>Nvidia</em> falls as much as 1.3% in premarket trading, putting the stock on course to snap a five-day winning streak that has boosted the market value of the world’s most valuable chip company beyond $1 trillion.",https://www.zerohedge.com/markets/futures-drop-markets-reasses-feds-hawkish-skip-ecb-looms,8.925
5,2023-06-15T12:00:29.000000Z,Nvidia Stock Got Away? Analysts Think These Techs Will Rally Next,NVDA,NVIDIA Corporation,"If you don't own the biggest S&P 500 tech stocks, like Nvidia (NVDA), you're missing out on the year's monster rally. But ETFs let you still take part of tech's...","If you don't own the biggest S&P 500 tech stocks, like <em>Nvidia</em> (NVDA), you're missing out on the year's monster rally. But ETFs let you still take part of tech's run without choosing the next absolute winners.

X

You might think every tech stock soared already this year — after all chipmaker <em>Nvidia</em> just hit a market value of $1 trillion.",https://www.investors.com/etfs-and-funds/etfs/sp500-nvidia-got-away-analysts-think-these-tech-stocks-will-rally-next/?src=A00220&yptr=yahoo,7.003
1,2023-06-15T11:37:35.000000Z,Morning Blast: Mega-caps and Semiconductors: Investors’ New Safe Space? – 24/7 Wall St.,NVDA,NVIDIA Corporation,"Morning Blast: Mega-caps and Semiconductors: Investors' New Safe Space?

Premarket action on Thursday had the three major U.S. indexes trading lower. The Dow Jo...","(NASDAQ: INTC), <em>Nvidia</em> Corp. (<em>NASDAQ</em>: <em>NVDA</em>) and Broadcom Inc. (NASDAQ: AVGO), up 4.92%, 4.81% and 4.12%, respectively. Advanced Micro Devices Inc. (NASDAQ: AMD) introduced its new “superchip” on Tuesday, and Intel claimed Wednesday that its own high-performance silicon is even better.",https://247wallst.com/investing/2023/06/15/morning-blast-mega-caps-and-semiconductors-investors-new-safe-space/,743
3,2023-06-15T11:10:38.000000Z,Tesla’s Record Winning Streak Starts to Unwind After 41% Surge,NVDA,NVIDIA Corporation,"(Bloomberg) -- A day after snapping its longest-ever winning streak, Tesla Inc. is embarking on a losing run.

Most Read from Bloomberg

The stock slid 3.2% as ...","<em>Nvidia</em> Corp., which has led megacap tech stocks higher this year, also fell in premarket trading, set to snap a five-day winning streak. Nasdaq 100 Index futures were trading down 0.7%

Story Link: Tesla Set to Extend Losses After Snapping Record Winning Streak

--With assistance from Esha Dey.",https://finance.yahoo.com/news/tesla-record-winning-streak-starts-111038495.html?.tsrc=rss,7.003
5,2023-06-15T11:10:00.000000Z,The Most Successful Hedge Fund Manager in History Is Selling Tesla Stock and Buying This Nasdaq Index Fund,NVDA,NVIDIA Corporation,"Ken Griffin's Citadel reported a record profit of $16 billion last year, bring its total earnings to $66 billion since its inception in 1990. That makes Griffin...","Microsoft: 12.9% Apple: 12.3% Alphabet: 7.8% Amazon: 6.8% <em>Nvidia</em>: 6.6% Tesla: 4.2% Meta Platforms: 4.1% Broadcom: 2.4% PepsiCo: 1.7% Costco Wholesale: 1.6%

The Invesco QQQ Trust was the best-performing large-cap growth fund of the last 15 years. The index fund produced a total return of 750% (or 15.3% annually) during that time.",https://www.fool.com/investing/2023/06/15/successful-hedge-fund-manager-selling-tesla-stock/,765
1,2023-06-15T23:16:29.000000Z,The 2023 Bull Market For Tesla Began With A Key Reversal On January 6,TSLA,"Tesla, Inc.","Charger with Tesla logo at a Supercharger rapid battery charging station for the electric vehicle ... [+] company Tesla Motors, in the Silicon Valley town of Mo...","Charger with <em>Tesla</em> logo at a Supercharger rapid battery charging station for the electric vehicle ... [+] company <em>Tesla</em> Motors, in the Silicon Valley town of Mountain View, California, August 24, 2016. (Photo by Smith Collection/Gado/Getty Images).",https://www.forbes.com/sites/richardhenrysuttmeier/2023/06/15/the-2023-bull-market-for-tesla-began-with-a-key-reversal-on-january-6/,0.0
3,2023-06-15T21:02:58.000000Z,"Dow Jones Futures: Stocks Run As Microsoft Roars, But This Risk Grows; Adobe Hails 'AI Era'",TSLA,"Tesla, Inc.","Dow Jones futures tilted lower after hours, along with S&P 500 futures and Nasdaq futures. Adobe (ADBE) rose overnight on strong results and earnings guidance.
...","Try SwingTrader

IBD Digital: Unlock IBD's Premium Stock Lists, Tools And Analysis Today

<em>Tesla</em> Vs. BYD: EV Giants Vie For Crown, But Which Is The Better Buy?",https://www.investors.com/market-trend/stock-market-today/dow-jones-futures-stocks-run-as-microsoft-roars-but-this-risk-grows-adobe-hails-ai-era/,4.404
5,2023-06-15T20:45:13.000000Z,"Why Lucid, Canoo, and QuantumScape Stocks Are Sizzling Today",TSLA,"Tesla, Inc.","Shares of electric vehicle (EV) stocks scored strong gains in afternoon trading on Thursday, with luxury EV maker Lucid Group (NASDAQ: LCID) gaining 3.2%, batte...","<em>Tesla</em> is the reason, but in a curious manner.",https://finance.yahoo.com/m/7da3f525-8d28-3eee-882c-93a83279a2dd/why-lucid%2C-canoo%2C-and.html?.tsrc=rss,4.497
1,2023-06-15T20:35:58.000000Z,Gurus Are Driving Away With These 5 Auto Stocks,TSLA,"Tesla, Inc.","Summary

Toyota shares spiked after it revealed its EV plans.

Auto manufacturers that were popular with gurus in the first quarter included Tesla, GM, Ford, St...","Auto manufacturers that were popular with gurus in the first quarter included <em>Tesla</em>, GM, Ford, Stellantis and Ferrari.

Shares of automaker Toyota Motor Corp. (TM, Financial) climbed more than 5% on Tuesday morning after its plans for next-generation battery electric vehicles were announced.

Price chart for Toyota Motor.",https://www.forbes.com/sites/gurufocus/2023/06/15/gurus-are-driving-away-with-these-5-auto-stocks/,6.124
3,2023-06-15T20:06:09.000000Z,Meta Is All About AI These Days But The Metaverse Is Still In The Air,TSLA,"Tesla, Inc.","While AI has long been on the activity schedule of Meta Platforms Inc (NASDAQ: META), the social technology and online ad company was often left outside the AI ...","The letter, which contained over 31,000 signatures, included even <em>Tesla</em> <em>Inc</em> (<em>NASDAQ</em>: <em>TSLA</em>) CEO Elon Musk who believes AI is one of the biggest risks to the future of civilization. Palantir Technologies Inc (NYSE: PLTR) CEO Alex Karp believes that those are calling for a pause are doing so because they don’t have a product in store.",https://finance.yahoo.com/news/meta-ai-days-metaverse-still-200609626.html?.tsrc=rss,-2.732
5,2023-06-15T19:46:09.000000Z,SK Signet to launch EV chargers with Tesla's charging standard By Reuters,TSLA,"Tesla, Inc.","Published Jun 15, 2023 03:42PM ET

© Reuters. FILE PHOTO: Newly installed car chargers at a Tesla Super Charging station are shown in Carlsbad, California, U.S...","FILE PHOTO: Newly installed car chargers at a <em>Tesla</em> Super Charging station are shown in Carlsbad, California, U.S. Sept. 14, 2018.",https://www.investing.com/news/stock-market-news/sk-signet-to-launch-ev-chargers-with-teslas-charging-standard-3106589,5.994
1,2023-06-15T19:32:00.000000Z,"Tesla’s EV charging standard is becoming widely adopted, in another boost for the stock",TSLA,"Tesla, Inc.","Tesla Inc.’s fast-charging standard is becoming the predominant standard in the U.S., boosting Tesla’s stock and opening up new revenue streams for the elec...","<em>Tesla</em> <em>Inc</em>.’s fast-charging standard is becoming the predominant standard in the U.S., boosting Tesla’s stock and opening up new revenue streams for the electric-vehicle maker.

<em>Tesla</em> shares TSLA are looking at a gain of more than 5% this week, adding to an already spectacular May and June, with the stock up nearly 60% from the end of April.",https://www.marketwatch.com/story/teslas-ev-charging-standard-is-becoming-widely-adopted-in-another-boost-for-the-stock-cfee38ab,7.906
3,2023-06-15T18:41:43.000000Z,General Motors and Ford executives comment on rebound of U.S. consumer demand By Investing.com,TSLA,"Tesla, Inc.","Published Jun 15, 2023 02:47PM ET

© Reuters. General Motors (GM) and Ford (F) executives comment on rebound of US consumer demand

GM +2.18% Add to/Remove fro...","In January, <em>Tesla</em> (NASDAQ: ) CEO Elon Musk predicted a ""serious recession"" and responded by reducing prices on the company's electric vehicles.

However, thanks to the alleviation of supply chain challenges, the U.S. automotive market has shown signs of stability, and vehicle production has rebounded, approaching levels seen before the pandemic.",https://www.investing.com/news/stock-market-news/general-motors-and-ford-executives-comment-on-rebound-of-us-consumer-demand-432SI-3106565,258
5,2023-06-15T18:41:13.000000Z,"Japão dará US$854 mi à Toyota para produção de baterias para veículos elétricos, diz Nikkei Por Reuters",TSLA,"Tesla, Inc.","Publicado 15.06.2023 12:24 Atualizado 15.06.2023 15:41

© Reuters.

7203 +0,45% Adicionar/Remover de uma Carteira TMCO34 +2,31% Adicionar/Remover de uma Cartei...","A empresa apresentou esta semana um plano abrangente para novas tecnologias e um redesenho radical das fábricas, enviando o sinal mais claro de sua intenção de capturar uma fatia maior do mercado de baterias elétricas, onde foi superada em vendas por rivais como a <em>Tesla</em> (NASDAQ: ).",https://br.investing.com/news/stock-market-news/japao-dara-us854-mia-toyota-para-producao-de-baterias-para-veiculos-eletricos-diz-nikkei-1122672,2.732
1,2023-06-15T18:11:33.000000Z,"Tesla to reduce shifts at German plant, says production targets are on track By Investing.com",TSLA,"Tesla, Inc.","Published Jun 15, 2023 02:13PM ET

© Reuters. Tesla (TSLA) to reduce shifts at German plant, says production targets are on track

TSLA -0.11% Add to/Remove fr...","<em>Tesla</em> (TSLA) to reduce shifts at German plant, says production targets are on track

TSLA -0.11% Add to/Remove from Watchlist

<em>Tesla</em> (NASDAQ: ) announced Thursday that it plans to hire fewer temporary workers at its plant near Berlin compared to the initial ramp-up phase. Additionally, the company will no longer schedule Saturday shifts.",https://www.investing.com/news/stock-market-news/tesla-to-reduce-shifts-at-german-plant-says-production-targets-are-on-track-432SI-3106548,-296
3,2023-06-15T16:55:06.000000Z,Meloni incontrerà stasera Elon Musk a Roma,TSLA,"Tesla, Inc.","Pubblicato 15.06.2023 18:51

© Reuters. La presidente del Consiglio Giorgia Meloni tiene la conferenza stampa di fine anno a Roma, 29 dicembre 2022. REUTERS/Gu...","REUTERS/Guglielmo Mangiapane

TSLA +0,07% Aggiungi/Rimuovi dal Portafoglio

MILANO (Reuters) - La presidente del Consiglio Giorgia Meloni, dovrebbe incontrare oggi a Roma il numero uno di <em>Tesla</em> (NASDAQ: ) Elon Musk, secondo quanto riportano due fonti governative.

Stamani Musk ha incontrato il ministro degli Esteri, Antonio Tajani.",https://it.investing.com/news/stock-market-news/meloni-incontrera-stasera-elon-musk-a-roma--fonti-2151511,2.732
5,2023-06-15T16:50:16.000000Z,Tesla: Onward and Upward,TSLA,"Tesla, Inc.","Tesla Inc. (NASDAQ:TSLA) is arguably one of the most sought-after stocks in the market, with analysts asserting this popular electric vehicle manufacturer has y...","<em>Tesla</em> <em>Inc</em>. (<em>NASDAQ:TSLA</em>) is arguably one of the most sought-after stocks in the market, with analysts asserting this popular electric vehicle manufacturer has yet to reach its peak.

Several factors support this sentiment. <em>Tesla</em> has been securing significant deals with prominent leaders in the auto industry, further enhancing its prospects.",https://finance.yahoo.com/news/tesla-onward-upward-165016580.html?.tsrc=rss,8.126
1,2023-06-15T16:50:16.000000Z,Tesla: Onward and Upward,TSLA,"Tesla, Inc.","Tesla Inc. ( TSLA, Financial) is arguably one of the most sought-after stocks in the market, with analysts asserting this popular electric vehicle manufacturer ...","<em>Tesla</em> <em>Inc</em>. ( TSLA, Financial) is arguably one of the most sought-after stocks in the market, with analysts asserting this popular electric vehicle manufacturer has yet to reach its peak.

Several factors support this sentiment. <em>Tesla</em> has been securing significant deals with prominent leaders in the auto industry, further enhancing its prospects.",https://www.gurufocus.com/news/2021817/tesla-onward-and-upward,8.126
3,2023-06-15T16:43:03.000000Z,The 7 companies driving the U.S. stock market rally,TSLA,"Tesla, Inc.","This advertisement has not loaded yet, but your article continues below.

Ross McKitrick: The truth about forest fires goes up in climate-change smoke

The 7 co...","., <em>Tesla</em> <em>Inc</em>. and Meta Platforms Inc. — have ripped higher, gaining between 40 per cent and 180 per cent this year. The remaining 493 companies are, in aggregate, flat. Photo by Kimihiro Hoshino/AFP via Getty Images Big tech companies dominate the index to an unprecedented degree.",https://financialpost.com/financial-times/7-companies-driving-us-stock-market-rally,3.182
5,2023-06-15T16:30:00.000000Z,"Coinbase (NASDAQ: COIN) is fourth most traded share in UK, ranks higher than Meta (NASDAQ: META) and Apple (NASDAQ: AAPL)",TSLA,"Tesla, Inc.","June 15, 2023 (Investorideas.com Newswire) Coinbase is the fourth most traded share across the United Kingdom, according to new +Insights data from May 1, 2022,...","From May to April, the UK's most traded share is <em>Tesla</em>. Amazon and NIO are the second and third most-traded shares, followed by Coinbase. No other cryptocurrency company appears in the national top ten.",https://www.investorideas.com/news/2023/cryptocurrency/06152Coinbase.asp,6.096
1,2023-06-15T16:12:24.000000Z,Is The Stock Market Open On Juneteenth?,TSLA,"Tesla, Inc.","Juneteenth National Independence Day falls on Monday, June 19, 2023. The U.S. bond market, and both the NASDAQ and New York Stock Exchange (NYSE) are closed in ...","Also Read: <em>Tesla</em> Stock Is Up More Than 50% Over The Past Month: Why Jim Cramer Is Calling It ‘The Princess Bride’ Rally

Looking ahead, the markets are closed on the following holidays in 2023:

Independence Day — Tuesday, July 4

Labor Day — Monday, September 4

Thanksgiving Day — Thursday, November 23

Christmas Day — Monday, December 25

Why is Juneteenth",https://www.benzinga.com/markets/equities/23/06/32878892/is-the-stock-market-open-on-juneteenth,3.818
3,2023-06-15T16:12:08.000000Z,Toyota Is Finally Waking Up To The EV Reality,TSLA,"Tesla, Inc.","As the EV revolution took the automotive industry, Toyota Motor (OTC: TOYOF) stubbornly sticked to its beliefs that hydrogen will power the future in which hybr...","For a decade, Toyota sat idly while <em>Tesla</em> <em>Inc</em> (<em>NASDAQ</em>: <em>TSLA</em>) sparked the EV revolution that is now in full swing. But, we the new CEO at the helm, Toyota is finally waking up to the EV reality.

A Battery Breakthrough

Without offering any technical details Toyota announced this week it achieved a breakthrough in battery technology.",https://finance.yahoo.com/news/toyota-finally-waking-ev-reality-161208116.html?.tsrc=rss,0.0
5,2023-06-15T16:11:13.000000Z,"Italy's Meloni to meet Musk in Rome, sources say By Reuters",TSLA,"Tesla, Inc.","Published Jun 15, 2023 12:06PM ET

© Reuters. FILE PHOTO: SpaceX, Twitter and Tesla CEO Elon Musk looks on as he attends a roundtable during the 6th edition of...","FILE PHOTO: SpaceX, Twitter and <em>Tesla</em> CEO Elon Musk looks on as he attends a roundtable during the 6th edition of the ""Choose France"" Summit at the Chateau de Versailles, outside Paris, France on May 15, 2023.",https://www.investing.com/news/stock-market-news/italys-meloni-to-meet-musk-in-rome-sources-say-3106493,0.0
1,2023-06-15T15:47:10.000000Z,"Peter Lynch Said: If You Spend 13 Minutes A Year On Economics, You've Wasted 10 Minutes",TSLA,"Tesla, Inc.","winyuu

Unless you've read a lot of older investment books, chances are members of the Gen Z or Millennial generations haven't heard of legendary stock picker P...","Trust me, year-to-date through June 14, 2023, I get it that Nvidia (NVDA) is up 194% ($146 to $430), Apple (AAPL) is up 41.5% ($130 to $184), Microsoft (MSFT) is up 40.4% ($240 to $337), Meta Platforms (META) is up 127.5% ($120 to $273), and <em>Tesla</em> (TSLA) is up 109% ($123 to $257).

Are these stocks very stretched and overvalued?",https://seekingalpha.com/article/4611743-as-peter-lynch-said-if-you-spend-13-minutes-a-year-on-economics-youve-wasted-10-minutes,5.106
3,2023-06-15T15:36:50.000000Z,"Ford CFO sees supply disruptions easing, retail prices softening By Reuters",TSLA,"Tesla, Inc.","Published Jun 15, 2023 11:32AM ET

© Reuters. The logo of Ford is seen on a 2020 Ford Explorer car at Ford's Chicago Assembly Plant in Chicago, Illinois, U.S. ...","Lawler said Ford's recent decision to join <em>Tesla</em> (NASDAQ: )'s EV charging network will not require additional capital investment on Ford's part.

Owners of Ford electric vehicles will gain access to more than 12,000 <em>Tesla</em> Superchargers in North America, starting in early 2024.",https://www.investing.com/news/stock-market-news/ford-cfo-sees-supply-disruptions-easing-retail-prices-softening-3106421,6.808
5,2023-06-15T15:36:00.000000Z,Have You Missed the 2023 Stock Rally?,TSLA,"Tesla, Inc.","(1:00) - What Should Investors Know About ETF Inflows Right Now?

(12:45) - Can The Meet Kevin Pricing Power ETF Be The Next ARKK?

(18:00) - What Is The Best P...","<em>Tesla</em>, <em>Inc</em>. (TSLA)

<em>Tesla</em> shares have rallied 13 days in a row in June 2023 and are now up 108.5% year-to-date.

Analysts have been cutting Tesla’s 2023 earnings estimates in the last 60 days. Earnings are now expected to be down 12.5% to $3.56 from $4.07 last year. But they are forecast to rebound in 2024 by 32.5% to $4.72.",https://finance.yahoo.com/news/missed-2023-stock-rally-153600449.html?.tsrc=rss,1.779
