id,published_at,title,symbol,name,snippet,highlight,url,sentiment
1,2023-06-15T23:15:38.000000Z,TMH Market Open: ASX to open green following sixth consecutive night of Wall Street gains,AAPL,Apple Inc.,"Be the first with the news that moves the market

Subscribe Be the first with the news that moves the market

Australian shares are set to open in the green, fo...","<em>Apple</em> increased just one per cent.

While US jobless claims surpassed expectations, sales unexpectedly rose in May, with data showing consumers increased spending on vehicles and building materials. The news could help stave off a recession in the near term.",https://themarketherald.com.au/tmh-market-open-asx-to-open-green-following-sixth-consecutive-night-of-wall-street-gains-2023-06-16/,4.767
2,2023-06-15T21:15:12.000000Z,Apple Stock: A Gaming Changer For Mac? (NASDAQ:AAPL),AAPL,Apple Inc.,"Shahid Jamil

So Fast

All I could think during the first two-thirds of Apple's (NASDAQ:AAPL) Worldwide Developers Conference (WWDC) keynote was, ""Slow down!"" I...","Shahid Jamil

So Fast

All I could think during the first two-thirds of Apple's (<em>NASDAQ:AAPL</em>) Worldwide Developers Conference (WWDC) keynote was, ""Slow down!"" I've been watching these things since they first started streaming them on the internet, and this was by far the fastest pace I had ever seen.",https://seekingalpha.com/article/4611820-apple-a-gaming-changer-for-mac,0
3,2023-06-15T21:02:58.000000Z,"Dow Jones Futures: Stocks Run As Microsoft Roars, But This Risk Grows; Adobe Hails 'AI Era'",AAPL,Apple Inc.,"Dow Jones futures tilted lower after hours, along with S&P 500 futures and Nasdaq futures. Adobe (ADBE) rose overnight on strong results and earnings guidance.
...","Microsoft (MSFT) was a big driver for the major indexes, with <em>Apple</em> (AAPL) and Meta Platforms (META) also contributing. But market breadth was strong.

Cava (CAVA) surged 99% in its debut Thursday, after CAVA stock priced its IPO at 22 a share, above the expected range. CAVA stock opened at 42 and closed at 43.78.",https://www.investors.com/market-trend/stock-market-today/dow-jones-futures-stocks-run-as-microsoft-roars-but-this-risk-grows-adobe-hails-ai-era/,6.7051
1,2023-06-15T21:00:14.000000Z,"Warren Buffett's $151 Billion Gamble: Customers Won't Trade Their Apple iPhones For $10,000, And Here's Why",AAPL,Apple Inc.,"Legendary investor Warren Buffett, an ardent supporter of Apple Inc. stock, has highlighted the company’s exceptionally devoted customer base as a key factor ...","Legendary investor Warren Buffett, an ardent supporter of <em>Apple</em> <em>Inc</em>. stock, has highlighted the company’s exceptionally devoted customer base as a key factor in his admiration. According to Buffett, iPhone users display such unwavering brand loyalty that they would not permanently part ways with their phones even if offered $10,000.",https://finance.yahoo.com/news/warren-buffetts-151-billion-gamble-210014819.html?.tsrc=rss,9.345
3,2023-06-15T20:50:56.000000Z,Jarden Brief: Mediterranean restaurant group cooks up a storm on NYSE debut,AAPL,Apple Inc.,"Shares in Cava, the Mediterranean restaurant group, surged by more than 100 per cent. Photo / Mario Tama/Getty Images

Keeping you up to date with the latest ma...","Te Pūkenga, New Zealand’s largest tertiary education provider, has teamed up with <em>Apple</em> to address the technology sector gap for Māori and Pasifika individuals.

The collaboration is part of Apple’s Racial Equity and Justice Initiative.",https://www.nzherald.co.nz/business/jarden-brief-mediterranean-restaurant-group-cooks-up-a-storm-on-nyse-debut/YLLRN462YNGTRKWBI2MEGRZJQ4/,5.267
5,2023-06-15T20:47:31.000000Z,10 A-Rated Stocks Billionaires Are Loading Up On,AAPL,Apple Inc.,"In this piece, we will take a look at ten A-rated stocks billionaires are loading up on. For more stocks, head on over to 5 A-Rated Stocks Billionaires Are Load...","Combined with the fact that the regular, retail investor has an unprecedented amount of data available to them for making decisions, this makes investing appear to be a tedious task where one is always at the risk of either missing out on the next <em>Apple</em> or making a blunder based on missing out on a key piece of information.",https://www.insidermonkey.com/blog/10-a-rated-stocks-billionaires-are-loading-up-on-1156788/,-6.705
1,2023-06-15T20:47:31.000000Z,10 A-Rated Stocks Billionaires Are Loading Up On,AAPL,Apple Inc.,"In this piece, we will take a look at ten A-rated stocks billionaires are loading up on. For more stocks, head on over to 5 A-Rated Stocks Billionaires Are Load...","Combined with the fact that the regular, retail investor has an unprecedented amount of data available to them for making decisions, this makes investing appear to be a tedious task where one is always at the risk of either missing out on the next <em>Apple</em> or making a blunder based on missing out on a key piece of information.",https://finance.yahoo.com/news/10-rated-stocks-billionaires-loading-204731985.html?.tsrc=rss,-6.705
3,2023-06-15T20:42:38.000000Z,How to Play The AI Boom And NASDAQ Rally,AAPL,Apple Inc.,"In this piece we will talk about how to play the AI boom and the NASDAQ rally according to hedge fund manager Brad Gerstner.

One of the craziest trends these d...","Gerstner's pure play AI stock picks a bit later, one company that he mentioned during his interview was the Cupertino, California technology giant <em>Apple</em> <em>Inc</em>. (<em>NASDAQ:AAPL</em>). <em>Apple</em> held its World Wide Developers Conference (WWDC) in June 2023 and the event saw the first new product from the company in years.",https://finance.yahoo.com/news/play-ai-boom-nasdaq-rally-204238815.html?.tsrc=rss,0.34
5,2023-06-15T20:42:38.000000Z,How to Play The AI Boom And NASDAQ Rally,AAPL,Apple Inc.,"In this piece we will talk about how to play the AI boom and the NASDAQ rally according to hedge fund manager Brad Gerstner.

One of the craziest trends these d...","Gerstner’s pure play AI stock picks a bit later, one company that he mentioned during his interview was the Cupertino, California technology giant <em>Apple</em> <em>Inc</em>. (<em>NASDAQ:AAPL</em>). <em>Apple</em> held its World Wide Developers Conference (WWDC) in June 2023 and the event saw the first new product from the company in years.",https://www.insidermonkey.com/blog/how-to-play-the-ai-boom-and-nasdaq-rally-1157867/,0.34
1,2023-06-15T20:35:36.000000Z,"Wall Street en hausse, optimisme sur les taux Par Reuters",AAPL,Apple Inc.,"Publié le 15/06/2023 22:32

© Reuters. La Bourse de New York (NYSE). /Photo prise le 24 février 2022/REUTERS/Caitlin Ochs

US500 +1,22% Ajouter au/Supprimer ...","<em>Apple</em> (NASDAQ: ), Microsoft (NASDAQ: ) et Meta Platforms (NASDAQ: ) ont gagné entre 1,1% et 3,2%.

La hausse des cours du brut a parallèlement entraîné celle des valeurs du secteur de l'énergie.",https://fr.investing.com/news/stock-market-news/wall-street-en-hausse-optimisme-sur-les-taux-2185099,6.369
3,2023-06-15T20:32:38.000000Z,"Wall Street en hausse, optimisme sur les taux",AAPL,Apple Inc.,(Reuters) - La Bourse de New York a clôturé jeudi sur une hausse marquée grâce à la publication d'indicateurs économiques signalant une résistance de l'a...,"<em>Apple</em>, Microsoft et Meta Platforms ont gagné entre 1,1% et 3,2%.

La hausse des cours du brut a parallèlement entraîné celle des valeurs du secteur de l'énergie.",https://www.challenges.fr/finance-et-marche/wall-street-en-hausse-optimisme-sur-les-taux_858867?xtor=RSS-21,-5.106
5,2023-06-15T20:32:32.000000Z,Enthusiasm for Tech Stocks and Optimism About Fed Rate Hikes Lift Markets,AAPL,Apple Inc.,"Key Takeaways Markets jumped on Thursday, June 15, 2023, on enthusiasm for tech shares and optimism about Fed rate hikes.

Microsoft leads the Dow higher as sha...","Shares of <em>Apple</em> (AAPL), Cisco Systems (CSCO), and Salesforce (CRM) added more than 1%. Oracle (ORCL) shares were in the green for the sixth day in a row.",https://www.investopedia.com/tech-stocks-and-fed-rate-optimish-lift-markets-7547497,5.267
1,2023-06-15T20:17:25.000000Z,US STOCKS-S&P 500 leaps to highest close in 14 months; traders bet US rates near peak,AAPL,Apple Inc.,"(For a Reuters live blog on U.S., UK and European stock markets, click or type LIVE/ in a news window)

*

May retail sales rise unexpectedly, jobless claims fl...","Treasury yields slid after a slew of economic data pointed to easing inflation, helping offset worries about future rate hikes and boosting <em>Apple</em> and Microsoft to record highs.

Data showed U.S. retail sales unexpectedly rose in May as consumers spent on a range of goods including vehicles.",https://finance.yahoo.com/news/us-stocks-p-500-leaps-201725132.html?.tsrc=rss,5.574
3,2023-06-15T20:17:25.000000Z,Le S&P 500 atteint son plus haut niveau depuis 14 mois ; les traders parient sur le fait que les taux américains sont proches de leur maximum.,AAPL,Apple Inc.,"(Pour un blog Reuters en direct sur les marchés boursiers américains, britanniques et européens, cliquez ou tapez LIVE/ dans une fenêtre de nouvelles)

* Le...","Les rendements des bons du Trésor ont baissé après qu'une série de données économiques aient indiqué une baisse de l'inflation, aidant à compenser les inquiétudes concernant les futures hausses de taux et stimulant <em>Apple</em> et Microsoft à des niveaux record.",https://www.zonebourse.com/cours/indice/S-P-500-4985/actualite/Le-S-P-500-atteint-son-plus-haut-niveau-depuis-14-mois-les-traders-parient-sur-le-fait-que-les-tau-44124587/,
5,2023-06-15T20:10:00.000000Z,Cleantech and Climate Change Podcast - EV stocks on the move; is Cleantech the New AI for Investors?,AAPL,Apple Inc.,"Vancouver, Kelowna, Delta, BC - June 15, 2023 (Investorideas.com Newswire) Investorideas.com, a global news source and leading investor resource covering cleant...","If you would like to be a guest on this podcast and tell your story please call me at 800 665 0411

Visit the Cleantech and Climate Change Podcast page at Investorideas.com

The Investorideas.com podcasts are also available on iTunes (<em>Apple</em> Podcasts), Amazon, Audible, Spotify, Tunein, Stitcher, Spreaker.com, iHeartRadio, and most audio platforms available",https://www.investorideas.com/news/2023/cleantech-podcasts/06151NIO-MKLA-XPEV-MULN.asp,6.705
1,2023-06-15T20:17:25.000000Z,US STOCKS-S&P 500 leaps to highest close in 14 months; traders bet US rates near peak,AAPL,Apple Inc.,"(For a Reuters live blog on U.S., UK and European stock markets, click or type LIVE/ in a news window)

*

May retail sales rise unexpectedly, jobless claims fl...","Treasury yields slid after a slew of economic data pointed to easing inflation, helping offset worries about future rate hikes and boosting <em>Apple</em> and Microsoft to record highs.

Data showed U.S. retail sales unexpectedly rose in May as consumers spent on a range of goods including vehicles.",https://finance.yahoo.com/news/us-stocks-p-500-leaps-201725132.html?.tsrc=rss,5.574
3,2023-06-15T20:17:25.000000Z,Le S&P 500 atteint son plus haut niveau depuis 14 mois ; les traders parient sur le fait que les taux américains sont proches de leur maximum.,AAPL,Apple Inc.,"(Pour un blog Reuters en direct sur les marchés boursiers américains, britanniques et européens, cliquez ou tapez LIVE/ dans une fenêtre de nouvelles)

* Le...","Les rendements des bons du Trésor ont baissé après qu'une série de données économiques aient indiqué une baisse de l'inflation, aidant à compenser les inquiétudes concernant les futures hausses de taux et stimulant <em>Apple</em> et Microsoft à des niveaux record.",https://www.zonebourse.com/cours/indice/S-P-500-4985/actualite/Le-S-P-500-atteint-son-plus-haut-niveau-depuis-14-mois-les-traders-parient-sur-le-fait-que-les-tau-44124587/,0.0
5,2023-06-15T20:10:00.000000Z,Cleantech and Climate Change Podcast - EV stocks on the move; is Cleantech the New AI for Investors?,AAPL,Apple Inc.,"Vancouver, Kelowna, Delta, BC - June 15, 2023 (Investorideas.com Newswire) Investorideas.com, a global news source and leading investor resource covering cleant...","If you would like to be a guest on this podcast and tell your story please call me at 800 665 0411

Visit the Cleantech and Climate Change Podcast page at Investorideas.com

The Investorideas.com podcasts are also available on iTunes (<em>Apple</em> Podcasts), Amazon, Audible, Spotify, Tunein, Stitcher, Spreaker.com, iHeartRadio, and most audio platforms available",https://www.investorideas.com/news/2023/cleantech-podcasts/06151NIO-MKLA-XPEV-MULN.asp,6.705
1,2023-06-15T19:49:18.000000Z,Microsoft notches record high valuation of nearly $2.6 trillion,AAPL,Apple Inc.,"A Microsoft logo is seen in Issy-les-Moulineaux near Paris

By Chibuike Oguh

NEW YORK (Reuters) -Microsoft Corp shares rose to a new record high close on Thurs...","In addition, <em>Apple</em> <em>Inc</em> shares also achieved a record high close of $186.01 on Thursday, while shares of graphics chipmaker Nvidia set a fresh intraday record of $432.89.

Earlier Thursday, JPMorgan analysts raised their price target on Microsoft's stock, citing AI driving demand for the company's products.",https://finance.yahoo.com/news/microsoft-shares-pace-notch-record-194918338.html?.tsrc=rss,6.369
3,2023-06-15T19:37:40.000000Z,Apple trades to a new all-time high. Microsoft banging against its high too,AAPL,Apple Inc.,Shares of Apple are trading at a new all-time high today. The high price reached $186.49 which took out the high price from June 6 at $184.93. That high from Ju...,"Shares of <em>Apple</em> are trading at a new all-time high today. The high price reached $186.49 which took out the high price from June 6 at $184.93. That high from June 6, took out the January 2022 high price at $182.87. The low price from <em>Apple</em> in 2023 was on the 1st trading day of the year at $124.15

Microsoft has reached a high today of $349.35.",https://www.forexlive.com/news/apple-trades-to-a-new-all-time-high-microsoft-banging-against-its-high-too-20230615/,2.263
5,2023-06-15T17:36:44.000000Z,Wall Street sube con fuerza y Microsoft cotiza en zona de máximos históricos,AAPL,Apple Inc.,Los inversores celebran que la Fed haya puesto fin a una racha de diez subidas consecutivas en los tipos de interés y confían en que el ciclo de endurecimient...,"<em>Apple</em> y Alphabet registran subidas más moderadas, mientras que Amazon llega a ceder terreno.

Parte de la atención del mercado ha ido a parar hoy al debut en la Bolsa de Nueva York de los restaurantes Cava. Esta cadena de comida mediterránea se dispara más de un 90% en su primer día en el parqué.",https://www.expansion.com/mercados/2023/06/15/648b4b3f468aebb96c8b4620.html,7.096
1,2023-06-15T17:29:24.000000Z,The Fed Is Strangling the American Dream... 25 Basis Points at a Time,AAPL,Apple Inc.,"postcards from the florida republic

A few weeks ago, Deere (DR) and PepsiCo (PEP) took part in an AI conference showcasing the role of the tech in future opera...","<em>Apple</em>, Amazon, Alphabet and Meta spent more than $55 million on lobbying the federal government in 2021. That doesn’t mean directly to Congress. The spending is directed toward agencies as well. For them, it’s money well spent.",https://moneymorning.com/2023/06/15/the-fed-is-strangling-the-american-dream-25-basis-points-at-a-time/,5.574
3,2023-06-15T16:55:58.000000Z,"Wall street se reprend, les rendements baissent après les données économiques",AAPL,Apple Inc.,"(Pour un blog Reuters en direct sur les marchés boursiers américains, britanniques et européens, cliquez ou tapez LIVE/ dans une fenêtre de nouvelles)

* Le...","<em>Apple</em>, Microsoft et Meta Platforms ont gagné entre 0,7 % et 2,6 %.

""À ce stade, beaucoup d'argent a été mis de côté par les personnes qui avaient peur de la récession, et au fur et à mesure que les inquiétudes disparaissent, les gens reviennent vers les actions"", a déclaré David Russell, vice-président de Market Intelligence chez TradeStation.",https://www.zonebourse.com/cours/indice/S-P-500-4985/actualite/Wall-street-se-reprend-les-rendements-baissent-apres-les-donnees-economiques-44123820/,0.0
5,2023-06-15T16:43:03.000000Z,The 7 companies driving the U.S. stock market rally,AAPL,Apple Inc.,"This advertisement has not loaded yet, but your article continues below.

Ross McKitrick: The truth about forest fires goes up in climate-change smoke

The 7 co...","Seven of the biggest constituents — <em>Apple</em> <em>Inc</em>., Microsoft Corp., Google owner Alphabet Inc., Amazon.com Inc., Nvidia Corp., Tesla Inc. and Meta Platforms Inc. — have ripped higher, gaining between 40 per cent and 180 per cent this year. The remaining 493 companies are, in aggregate, flat.",https://financialpost.com/financial-times/7-companies-driving-us-stock-market-rally,4.215
1,2023-06-15T16:30:00.000000Z,"Coinbase (NASDAQ: COIN) is fourth most traded share in UK, ranks higher than Meta (NASDAQ: META) and Apple (NASDAQ: AAPL)",AAPL,Apple Inc.,"June 15, 2023 (Investorideas.com Newswire) Coinbase is the fourth most traded share across the United Kingdom, according to new +Insights data from May 1, 2022,...","The UK's top ten stocks consist of three auto manufacturing companies: Tesla, NIO, and Rivian; three technology stocks: Meta, <em>Apple</em>, Snap; one consumer discretionary stock: Amazon; one cryptocurrency company: Coinbase; one pharmaceutical, Aurora; one energy stock; Uniper.",https://www.investorideas.com/news/2023/cryptocurrency/06152Coinbase.asp,5.574
3,2023-06-15T16:24:19.000000Z,Markets Rise Midday as Tech Stocks Climb,AAPL,Apple Inc.,"Key Takeaways U.S. equities advanced at midday on June 15, 2023 as tech stocks climbed after the Fed paused rate hikes.

Tech stocks advanced, with shares of Mi...","Intel (INTC) shares also picked up 2%, and shares of <em>Apple</em> (AAPL), Cisco Systems (CSCO), and Meta Platforms (META) added 1%. Domino’s Pizza (DPZ) was the best-performing stock in the S&P 500 on an upgrade from Stifel. Shares of T-Mobile US (TMUS) jumped after Morgan Stanley reinstated the stock as a top pick.",https://www.investopedia.com/markets-rise-midday-as-tech-stocks-climb-amid-rate-hike-optimism-7547216,7.506
5,2023-06-15T16:20:06.000000Z,"Ethenea: azionario Usa squilibrato, un quarto dell’S&P 500 concentrato in 5 titoli Da FinanciaLounge",AAPL,Apple Inc.,"Pubblicato 15.06.2023 20:00

© Reuters. Ethenea: azionario Usa squilibrato, un quarto dell’S&P 500 concentrato in 5 titoli

AMZN -0,11% Aggiungi/Rimuovi dal ...","titoli

AMZN -0,11% Aggiungi/Rimuovi dal Portafoglio AAPL +0,69% Aggiungi/Rimuovi dal Portafoglio GOOGL +0,07% Aggiungi/Rimuovi dal Portafoglio MSFT +2,28% Aggiungi/Rimuovi dal Portafoglio US2000 +0,19% Aggiungi/Rimuovi dal Portafoglio GOOG +0,14% Aggiungi/Rimuovi dal Portafoglio

Il portfolio manager Christian Schmitt, commenta la concentrazione su <em>Apple</em>",https://it.investing.com/news/economy/ethenea-azionario-usa-squilibrato-un-quarto-dellsp-500-concentrato-in-5-titoli-2151500,0.0
1,2023-06-15T15:47:10.000000Z,"Peter Lynch Said: If You Spend 13 Minutes A Year On Economics, You've Wasted 10 Minutes",AAPL,Apple Inc.,"winyuu

Unless you've read a lot of older investment books, chances are members of the Gen Z or Millennial generations haven't heard of legendary stock picker P...","Trust me, year-to-date through June 14, 2023, I get it that Nvidia (NVDA) is up 194% ($146 to $430), <em>Apple</em> (AAPL) is up 41.5% ($130 to $184), Microsoft (MSFT) is up 40.4% ($240 to $337), Meta Platforms (META) is up 127.5% ($120 to $273), and Tesla (TSLA) is up 109% ($123 to $257).

Are these stocks very stretched and overvalued?",https://seekingalpha.com/article/4611743-as-peter-lynch-said-if-you-spend-13-minutes-a-year-on-economics-youve-wasted-10-minutes,5.106
3,2023-06-15T15:28:00.000000Z,先探／謝金河：台灣正能量股躍出,AAPL,Apple Inc.,"文／謝金河

二○二三年已經過了近半，在美國暴力升息下，利率從○∼○．二五％拉升到五∼五．二五％，十三日美國?...",今年科技股抬頭，Nasdaq大漲二九．八九％，更大型的Nasdaq 100指數大漲三六．五二％，<em>Apple</em>到一八四美元以上，再創歷史新高；微軟也逼近前波高點，它們都沾了ＡＩ的光，這比起標普五○○上漲十三．九六％，道瓊指數上漲三．五一％出色很多，這可以看出美國是科技股領軍，尤其是半導體，這次最核心的是Nvidia，上上周漲到四一九．三八美元，市值跑到一．○三五八兆美元，十三日Nvidia又站上四一一美元，市值站回一兆美元，TSMC ADR也提升到五五三九億美元，大約是Nvidia一半。,https://finance.ettoday.net/news/2520812?from=rss&redirect=1,5.574
5,2023-06-15T15:27:00.000000Z,ETtoday財經雲,AAPL,Apple Inc.,ＡＩ題材持續發酵，加權指數攻抵萬七大關，相關族群漲勢仍屬現在進行式；然而，也有些其他產業的個股，正在醞釀下?...,"文／黃俊超

美股籠罩多頭氛圍，S&P 500指數自去年十月低點漲幅逾兩成，達到定義上的牛市，S&P 500、Nasdaq與費城半導體，指數，持續創下今年來新高，ＡＩ題材搭配聯準會升息進入尾聲，是最主要的兩大原因，市場對於經濟後市展望看法分歧，本波漲勢主要集中在Microsoft、Google、Amazon、Meta、Nvidia、Tesla、<em>Apple</em>等少數的大型龍頭股身上。

老牌電子股大殺四方

[廣告]請繼續往下閱讀...",https://finance.ettoday.net/news/2520806?from=rss&redirect=1,5.574
1,2023-06-15T15:25:09.000000Z,"Fed Hits Pause And So Does Wall Street As Stocks Edge Lower Amid Rising Rates, Dollar - Apple (NASDAQ:AAPL), Adobe (NASDAQ:ADBE)",AAPL,Apple Inc.,"(Thursday market open) The relentless rally took a breather this morning following the Federal Reserve’s “hawkish pause.” Treasury yields rose, putting pr...","UnitedHealth is a very big company, but not really close to some of the monsters of the DJIA like <em>Apple</em> AAPL and Microsoft MSFT.",https://www.benzinga.com/markets/23/06/32877472/fed-hits-pause-and-so-does-wall-street-as-stocks-edge-lower-amid-rising-rates-dollar,5.023
3,2023-06-15T14:50:00.000000Z,Tesla Stock’s Winning Streak Is Over. Let the Losing Streak Begin.,AAPL,Apple Inc.,"Tesla stock’s winning streak was snapped at 13 consecutive days on Wednesday, but ven with one drop in the past 14 trading sessions, shares are up an incredib...","“This reminds us of when the Street started to realize the margin story and valuation at [ Amazon Web Services] for Amazon and the growth/margins of the <em>Apple</em> Services story in Cupertino,” added Ives.

Analysts frequently value AWS separately from Amazon’s retail business.",https://www.marketwatch.com/articles/tesla-stock-price-streak-ai-3fae95fc,5.859
5,2023-06-15T14:24:06.000000Z,Dow Jones Rallies 225 Points On Surprise Rise In Jobless Claims; Tesla Stock Reverses Higher,AAPL,Apple Inc.,"The Dow Jones Industrial Average rallied 225 points Thursday after a heavy slate of economic news, including the Labor Department's first-time jobless claims an...",Dow Jones tech giants <em>Apple</em> (AAPL) and Microsoft (MSFT) were higher after today's stock market open.,https://www.investors.com/market-trend/stock-market-today/dow-jones-futures-jobless-claims-tesla-stock-extends-losses/,0.0
1,2023-06-15T14:24:01.000000Z,Breaking Barriers - How Apple's Bold Stride Above Major Market Resistance Sets The Stage For New Record Highs - Apple (NASDAQ:AAPL),AAPL,Apple Inc.,"Apple Inc., a key player in the tech industry, has experienced notable fluctuations in its stock price, recently reaching an all-time high of $184 following the...","<em>Apple</em> <em>Inc</em>., a key player in the tech industry, has experienced notable fluctuations in its stock price, recently reaching an all-time high of $184 following the launch of its new product, Vision Pro.",https://www.benzinga.com/23/06/32875598/breaking-barriers-how-apples-bold-stride-above-major-market-resistance-sets-the-stage-for-new-record,4.215
3,2023-06-15T14:22:55.000000Z,Microsoft Shares on Course for New Record High as Rally Gains Steam,AAPL,Apple Inc.,"(Bloomberg) -- Microsoft Corp. is on pace to close at a record high, becoming the third mega-cap technology firm after Nvidia Corp. and Apple Inc. to scale new ...","(Bloomberg) -- Microsoft Corp. is on pace to close at a record high, becoming the third mega-cap technology firm after Nvidia Corp. and <em>Apple</em> <em>Inc</em>. to scale new heights this year as the sector rebounds on hopes that the Federal Reserve will start cutting interest rates.",https://finance.yahoo.com/news/microsoft-shares-course-record-high-142255057.html?.tsrc=rss,6.486
5,2023-06-15T14:05:24.000000Z,"Market Clubhouse Morning Memo - June 15th, 2023 (Trade Strategy For SPY, QQQ, AAPL, TSLA, MSFT, NVDA, And AI) - Invesco QQQ Trust, Series 1 (NASDAQ:QQQ)",AAPL,Apple Inc.,"Good Morning Traders! In today's Market Clubhouse Morning Memo, we will discuss SPY, QQQ, AAPL, TSLA, MSFT, NVDA, and AI.

Our proprietary formula, exclusive to...","<em>Apple</em> <em>Inc</em>.

At the moment, <em>Apple</em> AAPL is sustaining above the 183 price level and attempting to reclaim our upside support level of 183.38. Should <em>Apple</em> demonstrate buy-side strength today, our upside target is 184.09, with a further target of 184.35.",https://www.benzinga.com/23/06/32875121/market-clubhouse-morning-memo-june-15th-2023-trade-strategy-for-spy-qqq-aapl-tsla-msft-nvda-and-ai,7.096
